{
  "universe_version": "1.0",
  "frozen_at": "2026-08-17T00:25:00Z",
  "ranking_decision": {
    "publisher": "INFOLine (INFOLine-Аналитика)",
    "ranking_year": 2024,
    "metric": "Net retail sales / revenue excl. VAT (RUB billion)",
    "scope": "Top-10 FMCG and Food Retailers of the Russian Federation (Annual Industry Review 'Retail Food and Consumer Market of Russia / FMCG Retail Chains Rating')",
    "source_url": "https://infoline.spb.ru/news/?news=298744",
    "rationale": "INFOLine is the recognized primary industry benchmark and authoritative market research agency tracking Russian retail metrics since 2002. The annual FMCG Top-10 ranking based on Net Revenue (excl. VAT) provides a reproducible, methodologically rigorous, and consistent perimeter for all leading grocery and FMCG operators across omnichannel, offline, and q-commerce formats.",
    "limitations": [
      "Excludes pure marketplace 3P GMV non-retail turnover (e.g. Wildberries and Ozon total marketplace platform volumes), capturing strictly retail-oriented sales and direct inventory-bearing grocery models.",
      "Reflects M&A consolidations completed during the 2023-2024 calendar cycle (such as Lenta's acquisition of Monetka and Magnit's consolidation of Sambéri).",
      "Financial metrics for privately held groups (such as Mercury Retail Group and Torgservis/Svetofor) are calculated via aggregated statutory accounting records (RAS) and proprietary INFOLine audit estimates.",
      "Self-reported data from public disclosures (IFRS) reconciled with INFOLine standardized methodology without VAT to ensure cross-company comparability."
    ]
  },
  "retailers": [
    {
      "retailer_id": "R01",
      "rank": 1,
      "legal_group": "X5 Group (ПАО \"Корпоративный центр Икс 5\" / ООО \"Корпоративный центр Икс 5\")",
      "consumer_brands": [
        "Пятёрочка",
        "Перекрёсток",
        "Чижик",
        "Красный Яр",
        "Слата",
        "Vprok.ru",
        "Около"
      ],
      "ranking_value_raw": "3908.0 млрд руб.",
      "business_scope": "Федеральный мультиформатный продуктовый ритейл: магазины у дома ('Пятёрочка'), супермаркеты ('Перекрёсток'), жёсткие дискаунтеры ('Чижик'), региональные сети ('Красный Яр', 'Слата'), e-grocery ('Vprok.ru', экспресс-доставка), франчайзинг ('Около').",
      "include_primary_universe": true,
      "rationale": "Бессменный лидер продуктового ритейла РФ с выручкой 3 908 млрд руб. (+24,2% YoY в 2024 г.), долей рынка свыше 16% и масштабным присутствием во всех ключевых форматах и цифровых каналах.",
      "ownership_notes": "Публичная российская холдинговая компания (ПАО 'Корпоративный центр Икс 5', редомицилирована / переведена в юрисдикцию РФ по ФЗ-470). Контролирующий акционер — структура CTF Holdings / Альфа-Групп."
    },
    {
      "retailer_id": "R02",
      "rank": 2,
      "legal_group": "ПАО \"Магнит\" (PJSC Magnit)",
      "consumer_brands": [
        "Магнит у дома",
        "Магнит Семейный",
        "Магнит Экстра",
        "Магнит Косметик",
        "Магнит Аптека",
        "Дикси",
        "Самбери",
        "В1 (Первый выбор)",
        "Магнит Маркет",
        "Магнит Рядом"
      ],
      "ranking_value_raw": "3018.0 млрд руб.",
      "business_scope": "Федеральный мультиформатный ритейлер: магазины у дома ('Магнит у дома'), мягкие дискаунтеры ('Дикси'), суперсторы/гипермаркеты ('Магнит Семейный' / 'Экстра'), дрогери ('Магнит Косметик'), фармацевтический ритейл ('Магнит Аптека'), хард-дискаунтеры ('В1'), дальневосточная сеть ('Самбери'), e-commerce ('Магнит Маркет').",
      "include_primary_universe": true,
      "rationale": "Второй по объему выручки ритейлер России (3 018 млрд руб., +20,3% YoY в 2024 г.) с крупнейшей сетью физических магазинов (>30 000 точек) и максимальным географическим покрытием.",
      "ownership_notes": "Публичное акционерное общество (MOEX: MGNT). Крупнейшие институциональные и стратегические акционеры включают Marathon Group, менеджмент и пул миноритарных инвесторов после выкупа акций у нерезидентов."
    },
    {
      "retailer_id": "R03",
      "rank": 3,
      "legal_group": "Mercury Retail Group (ООО \"Меркурий Ритейл Холдинг\")",
      "consumer_brands": [
        "Красное & Белое",
        "Бристоль"
      ],
      "ranking_value_raw": "1404.0 млрд руб.",
      "business_scope": "Специализированный FMCG-ритейл ультрамалого формата (convenience / ultra-convenience store / specialty retail): алкогольная продукция, табачные изделия, бакалея, напитки, снеки, молочные и сопутствующие продовольственные товары повседневного спроса.",
      "include_primary_universe": true,
      "rationale": "Третий по величине FMCG-ритейлер РФ (выручка 1 404 млрд руб., +24,8% YoY в 2024 г.), оперирующий крупнейшей сетью алкомаркетов/магазинов у дома (>25 000 точек) с высокой плотностью продаж и стандартизированным ассортиментом.",
      "ownership_notes": "Частная непубличная компания. Бенефициарные владельцы — Сергей Студенников (основатель 'Красное & Белое'), Игорь Кесаев и Сергей Кациев (основатели 'Дикси' и 'Бристоль')."
    },
    {
      "retailer_id": "R04",
      "rank": 4,
      "legal_group": "МКПАО \"Лента\" (Lenta IPJSC / ООО \"Лента\")",
      "consumer_brands": [
        "Гипер Лента",
        "Супер Лента",
        "Мини Лента",
        "Монетка",
        "Улыбка радуги"
      ],
      "ranking_value_raw": "888.0 млрд руб.",
      "business_scope": "Федеральный мультиформатный продуктовый ритейлер: классические гипермаркеты ('Гипер Лента'), супермаркеты ('Супер Лента'), магазины у дома ('Мини Лента' и интегрированная сеть 'Монетка'), дрогери ('Улыбка радуги'), онлайн-бизнес ('Лента Онлайн').",
      "include_primary_universe": true,
      "rationale": "Четвертый игрок FMCG-рынка с динамикой выручки +44,2% YoY (до 888 млрд руб. в 2024 г.), обусловленной успешной интеграцией сети дискаунтеров 'Монетка' (свыше 2100 магазинов) и расширением дрогери-направления.",
      "ownership_notes": "Публичная международная компания (МКПАО 'Лента', MOEX: LNTA). Контролирующий акционер — инвестиционная компания 'Севергрупп' Алексея Мордашова."
    },
    {
      "retailer_id": "R05",
      "rank": 5,
      "legal_group": "ГК \"Торгсервис\" (Группа компаний \"Светофор\")",
      "consumer_brands": [
        "Светофор",
        "Маяк"
      ],
      "ranking_value_raw": "407.0 млрд руб.",
      "business_scope": "Сеть жёстких дискаунтеров складского типа (hard discounter / warehouse club): продажа продуктов питания длительного хранения, свежих и замороженных продуктов, бытовой химии и товаров non-food по минимальным ценам с паллетной выкладкой.",
      "include_primary_universe": true,
      "rationale": "Пятый по величине игрок на рынке FMCG (выручка 407 млрд руб. в 2024 г., +2,9% YoY), крупнейший оператор в сегменте классического жесткого дискаунтера в РФ.",
      "ownership_notes": "Непубличная децентрализованная группа частных компаний, зарегистрированных на членов семьи Шнайдер (Валентина, Сергей и Андрей Шнайдер) и региональных партнеров-управляющих."
    },
    {
      "retailer_id": "R06",
      "rank": 6,
      "legal_group": "АО \"Вкусвилл\" (JSC Vkusvill)",
      "consumer_brands": [
        "ВкусВилл",
        "ВкусВилл Мини",
        "ВкусВилл Айс",
        "ВкусВилл Доставка"
      ],
      "ranking_value_raw": "329.0 млрд руб.",
      "business_scope": "Специализированный розничный омниканальный ритейл натуральных продуктов питания и здорового образа жизни: магазины у дома, мини-маркеты ('ВкусВилл Мини'), собственная сеть дарксторов и сверхбыстрая бесплатная доставка (>50% выручки через онлайн-канал), микромаркеты и вендинг.",
      "include_primary_universe": true,
      "rationale": "Шестая позиция в рейтинге FMCG (выручка 329 млрд руб., +27,0% YoY в 2024 г.), опередил сеть 'Ашан' за счет взрывного роста собственной доставки, уникальной модели 95%+ СТМ и экспансии ультрамалых форматов.",
      "ownership_notes": "Непубличное акционерное общество (АО 'Вкусвилл'). Основатель и ключевой бенефициар — Андрей Кривенко и топ-менеджмент; миноритарный пакет у фонда Baring Vostok (Восток Инвестиции)."
    },
    {
      "retailer_id": "R07",
      "rank": 7,
      "legal_group": "ООО \"Ашан\" (Auchan Retail Russia / Elo Group)",
      "consumer_brands": [
        "Ашан",
        "Ашан Сити",
        "Атак",
        "Мой Ашан"
      ],
      "ranking_value_raw": "278.0 млрд руб.",
      "business_scope": "Крупноформатный розничный ритейл и супермаркеты: классические гипермаркеты 'Ашан', городские компактные гипермаркеты 'Ашан Сити', супермаркеты 'Атак' и магазины формата у дома 'Мой Ашан', цифровые каналы доставки (партнерские и собственные).",
      "include_primary_universe": true,
      "rationale": "Седьмое место на российском рынке FMCG (278 млрд руб., +0,8% YoY в 2024 г.); крупноформатный игрок с масштабной сетью гипермаркетов и значимым объемом продаж продуктов питания.",
      "ownership_notes": "Российская дочерняя структура французской ассоциации семьи Мюлье (Association Familiale Mulliez / холдинг Elo)."
    },
    {
      "retailer_id": "R08",
      "rank": 8,
      "legal_group": "ООО \"Метро Кэш энд Керри\" (Metro Cash & Carry Russia / METRO AG)",
      "consumer_brands": [
        "Metro",
        "Фасоль"
      ],
      "ranking_value_raw": "248.0 млрд руб.",
      "business_scope": "Мелкооптовая и розничная B2B/B2C торговля: торговые центры формата Cash & Carry для профессиональных клиентов (HoReCa, независимая розница) и физических лиц, франчайзинговая сеть магазинов у дома 'Фасоль', собственная b2b/b2c e-commerce доставка.",
      "include_primary_universe": true,
      "rationale": "Восьмой ритейлер в национальном рейтинге FMCG (выручка 248 млрд руб., +10,9% YoY в 2024 г.), ключевой B2B/B2C интегратор оптово-розничной дистрибуции продуктов питания и оператор франшизы 'Фасоль'.",
      "ownership_notes": "100% дочерняя компания международного немецкого ритейлера METRO AG."
    },
    {
      "retailer_id": "R09",
      "rank": 9,